{
  "generated_at": "2026-10-20T05:56:32Z",
  "count": 258,
  "active_count": 224,
  "expired_count": 34,
  "offers": [
    {
      "slug": "cline-minimax-m3-1-flash-free",
      "title": "MiniMax M3.1 Flash Free in Cline",
      "provider": "Cline",
      "category": "coding",
      "amount": "Free MiniMax M3.1 Flash in the Cline IDE extension and CLI, up to a limited free quota",
      "expiry_date": null,
      "source_url": "https://x.com/cline/status/2112220504258224605",
      "verified_date": "2026-10-20",
      "added_date": "2026-10-20",
      "verification": "social_proof",
      "review_status": "under-review",
      "signup": "required",
      "status": "active"
    },
    {
      "slug": "opencode-minimax-m3-1-flash-free",
      "title": "MiniMax M3.1 Flash Free on OpenCode",
      "provider": "OpenCode",
      "category": "coding",
      "amount": "Free MiniMax M3.1 Flash in the OpenCode app (free input, output and cached reads; limited time)",
      "expiry_date": null,
      "source_url": "https://opencode.ai/v2/docs/console/models/",
      "verified_date": "2026-10-20",
      "added_date": "2026-10-20",
      "verification": "social_proof",
      "review_status": "under-review",
      "signup": "none",
      "status": "active"
    },
    {
      "slug": "openrouter-minimax-m3-1-flash-free",
      "title": "MiniMax M3.1 Flash Free (OpenRouter)",
      "provider": "OpenRouter",
      "category": "api_provider",
      "amount": "Free minimax/minimax-m3.1-flash:free inference at $0 input and output (1M context; rate limited)",
      "expiry_date": null,
      "source_url": "https://openrouter.ai/minimax/minimax-m3.1-flash:free",
      "verified_date": "2026-10-20",
      "added_date": "2026-10-20",
      "verification": "social_proof",
      "review_status": "under-review",
      "signup": "required",
      "status": "active"
    },
    {
      "slug": "vercel-minimax-m3-1-flash-free",
      "title": "MiniMax M3.1 Flash Free (Vercel AI Gateway)",
      "provider": "Vercel",
      "category": "api_provider",
      "amount": "MiniMax M3.1 Flash at $0 on AI Gateway when served by MiniMax, through October 22",
      "expiry_date": "2026-10-22",
      "source_url": "https://vercel.com/changelog/minimax-m3-1-flash-now-available-on-ai-gateway-for-free",
      "verified_date": "2026-10-20",
      "added_date": "2026-10-20",
      "verification": "social_proof",
      "review_status": "under-review",
      "signup": "required",
      "status": "active"
    },
    {
      "slug": "agnes-ai-flash-models-free-api",
      "title": "Agnes AI Flash Models — Free API (agnes-2.5-flash, agnes-3.0-flash)",
      "provider": "Agnes AI",
      "category": "api_provider",
      "amount": "agnes-2.5-flash and agnes-3.0-flash text models currently free ($0/M cached input, input and output tokens; list $0.05/M input, $0.15/M output) via OpenAI-compatible API; promotional, end date subject to Agnes AI platform announcements",
      "expiry_date": null,
      "source_url": "https://wiki.agnes-ai.com/en/docs/pricing.md",
      "verified_date": "2026-10-16",
      "added_date": "2026-10-16",
      "verification": "social_proof",
      "review_status": "under-review",
      "signup": "required",
      "status": "active"
    },
    {
      "slug": "opencode-glm-5-3-flash-free",
      "title": "GLM-5.3-Flash Free on OpenCode Console",
      "provider": "OpenCode",
      "category": "coding",
      "amount": "Free GLM-5.3-Flash model access on OpenCode Console (free input, output and cached reads; limited time)",
      "expiry_date": null,
      "source_url": "https://opencode.ai/v2/docs/console/models/",
      "verified_date": "2026-10-16",
      "added_date": "2026-10-16",
      "verification": "social_proof",
      "review_status": "under-review",
      "signup": "none",
      "status": "active"
    },
    {
      "slug": "openrouter-nemotron-3-5-super-vl-free",
      "title": "Nemotron 3.5 Super VL Free (OpenRouter)",
      "provider": "OpenRouter",
      "category": "api_provider",
      "amount": "Free nvidia/nemotron-3.5-super-vl:free at $0 input/output (1M context, 120B-A12B multimodal MoE); rate-limited trial/internal evaluation only, not production",
      "expiry_date": null,
      "source_url": "https://openrouter.ai/nvidia/nemotron-3.5-super-vl:free",
      "verified_date": "2026-10-16",
      "added_date": "2026-10-16",
      "verification": "social_proof",
      "review_status": "under-review",
      "signup": "required",
      "status": "active"
    },
    {
      "slug": "y-combinator-ai-stack-student-credits",
      "title": "YC AI Stack — $25K+ in AI & Cloud Credits for YC Event Attendees",
      "provider": "Y Combinator",
      "category": "student",
      "amount": "Over $25,000 in free credits for AI tools and cloud services (AWS $10,000, Microsoft Azure $10,000, OpenAI $1,000, Anthropic $500, plus AI devtool credits) for students who attend an eligible YC event; access lasts one year from the event",
      "expiry_date": null,
      "source_url": "https://deals.ycombinator.com/students",
      "verified_date": "2026-10-16",
      "added_date": "2026-10-16",
      "verification": "social_proof",
      "review_status": "under-review",
      "signup": "required",
      "status": "active"
    },
    {
      "slug": "opencode-deepseek-v4-1-flash-free",
      "title": "DeepSeek V4.1 Flash Free on OpenCode",
      "provider": "OpenCode",
      "category": "coding",
      "amount": "Free DeepSeek V4.1 Flash (1017 update) in the OpenCode app (free input, output and cached reads; limited time)",
      "expiry_date": null,
      "source_url": "https://opencode.ai/v2/docs/console/models/",
      "verified_date": "2026-10-20",
      "added_date": "2026-10-15",
      "verification": "social_proof",
      "review_status": "under-review",
      "signup": "none",
      "status": "active"
    },
    {
      "slug": "opencode-cat-jam-free",
      "title": "Beam Free (formerly Cat Jam) on OpenCode Console",
      "provider": "OpenCode",
      "category": "coding",
      "amount": "Free Beam (formerly Cat Jam) model access on OpenCode Console (free input, output and cached reads; limited time)",
      "expiry_date": null,
      "source_url": "https://opencode.ai/v2/docs/console/models/",
      "verified_date": "2026-10-14",
      "added_date": "2026-10-14",
      "verification": "social_proof",
      "review_status": "under-review",
      "signup": "none",
      "status": "active"
    },
    {
      "slug": "google-antigravity-for-scientists",
      "title": "Google Antigravity Free Highest Tier for Scientists",
      "provider": "Google",
      "category": "coding",
      "amount": "6 months free on Google Antigravity's highest usage tier with Gemini 4 Argon (up to 10,000 selected scientists; application-based)",
      "expiry_date": null,
      "source_url": "https://antigravity.google/use-cases/science",
      "verified_date": "2026-10-13",
      "added_date": "2026-10-14",
      "verification": "social_proof",
      "review_status": "under-review",
      "signup": "required",
      "status": "active"
    },
    {
      "slug": "meta-global-ai-developer-hackathon",
      "title": "Meta Global AI Developer Hackathon API Credits",
      "provider": "Meta",
      "category": "api_provider",
      "amount": "$150 in Meta Model API credits per selected hackathon participant for ten days of development; applications open through Oct 25, 2026 at 11:59 PM ET, or earlier if 20,000 spots fill",
      "expiry_date": "2026-10-25",
      "source_url": "https://dev.meta.ai/events/global-hackathon",
      "verified_date": "2026-10-14",
      "added_date": "2026-10-13",
      "verification": "social_proof",
      "review_status": "to-be-verified",
      "signup": "required",
      "status": "active"
    },
    {
      "slug": "autoclaw-weekly-perks-glm-5-3-flash-tokens",
      "title": "AutoClaw Weekly Perks — 8M GLM-5.3-Flash Tokens Daily",
      "provider": "AutoClaw (Z.ai)",
      "category": "coding",
      "amount": "Log in daily Oct 13-16 to claim 8M GLM-5.3-Flash tokens (800 Credits) per day, up to 32M total; each day's reward expires at midnight (UTC+8) on the day it is claimed. Paid members get extra daily rewards.",
      "expiry_date": "2026-10-16",
      "source_url": "https://autoclaw.z.ai/blog/news/Weekly-Perks-M10W2/",
      "verified_date": "2026-10-13",
      "added_date": "2026-10-13",
      "verification": "social_proof",
      "review_status": "under-review",
      "signup": "required",
      "status": "expired"
    },
    {
      "slug": "brave-search-api-monthly-free-credits",
      "title": "Brave Search API — $5 Free Credits Every Month",
      "provider": "Brave",
      "category": "api_provider",
      "amount": "$5 in free credits every month on the Search plan ($5 per 1,000 requests) and the Answers plan; credits applied automatically; card required for identity verification but not charged; storing results requires explicit plan storage rights, and third-party content rights are not granted",
      "expiry_date": null,
      "source_url": "https://brave.com/search/api/",
      "verified_date": "2026-10-13",
      "added_date": "2026-10-13",
      "verification": "social_proof",
      "review_status": "under-review",
      "signup": "required",
      "status": "active"
    },
    {
      "slug": "dolphin-api-30-credit",
      "title": "Dolphin API — $10 API Credit",
      "provider": "Dolphin",
      "category": "api_provider",
      "amount": "$10 in Dolphin API credit with coupon code API10 (redeem at app.dphn.ai after connecting and verifying a wallet and authorizing with Telegram)",
      "expiry_date": null,
      "source_url": "https://dphn.ai/API/",
      "verified_date": "2026-10-13",
      "added_date": "2026-10-13",
      "verification": "social_proof",
      "review_status": "under-review",
      "signup": "required",
      "status": "active"
    },
    {
      "slug": "liner-api-signup-15-credits",